{
  "plan_summary": "用户素材为芒果超媒AI内容创作大赛，classify确认为新闻稿，对外宣传。素材包含时间、主办方、参赛规模和获奖作品，但缺少地点、获奖详情，需注意不得编造领导信息。",
  "doc_type": "新闻稿",
  "direction": "对外宣传",
  "style_level": 3,
  "risk_level": "low",
  "title_plan": {
    "recommended_title": "芒果超媒AI内容创作大赛举行 《AI导演》获一等奖",
    "title_type": "直述式",
    "title_confidence": 0.85,
    "title_basis": [
      "extract.event = AI内容创作大赛",
      "extract.organization = 芒果超媒",
      "extract.product = 《AI导演》",
      "extract.achievement = 一等奖作品全流程AI辅助制作"
    ],
    "title_risks": [],
    "alternative_titles": [
      "芒果超媒举办AI内容创作大赛 12个团队同台竞技"
    ]
  },
  "addressee_plan": {
    "recommended_addressee": "",
    "source": "not_applicable",
    "confidence": 0,
    "needs_manual_confirmation": false,
    "note": "新闻稿对外宣传无需主送单位"
  },
  "signer_plan": {
    "recommended_signer": "",
    "source": "not_applicable",
    "confidence": 0,
    "needs_manual_confirmation": false,
    "note": "新闻稿无需落款"
  },
  "sections": [
    {
      "section_id": "S1",
      "section_name": "标题",
      "purpose": "新闻稿标题，突出核心信息，吸引阅读",
      "content_guidance": "使用直述式或概括式标题，包含活动名称、主办方和获奖亮点，避免使用领导信息。",
      "fact_bindings": [
        {
          "fact_type": "event",
          "fact_value": "AI内容创作大赛",
          "source_from_extract": true
        },
        {
          "fact_type": "organization",
          "fact_value": "芒果超媒",
          "source_from_extract": true
        },
        {
          "fact_type": "product",
          "fact_value": "《AI导演》",
          "source_from_extract": true
        }
      ],
      "blocked_items": [
        "不得编造领导出席",
        "不得编造领导评价",
        "不得编造成果数据",
        "不得将内部通知写成新闻传播稿"
      ],
      "word_count_estimate": 30,
      "needs_manual_input": false
    },
    {
      "section_id": "S2",
      "section_name": "导语",
      "purpose": "5W1H开头：时间、主体、核心事件",
      "content_guidance": "以'4月15日，芒果超媒…'开头，交代活动基本情况。",
      "fact_bindings": [
        {
          "fact_type": "time",
          "fact_value": "4月15日",
          "source_from_extract": true
        },
        {
          "fact_type": "organization",
          "fact_value": "芒果超媒",
          "source_from_extract": true
        },
        {
          "fact_type": "event",
          "fact_value": "AI内容创作大赛",
          "source_from_extract": true
        }
      ],
      "blocked_items": [
        "不得编造领导出席",
        "不得编造领导评价",
        "不得编造成果数据",
        "不得将内部通知写成新闻传播稿",
        "不得补充活动地点"
      ],
      "word_count_estimate": 100,
      "needs_manual_input": false
    },
    {
      "section_id": "S3",
      "section_name": "事件主体",
      "purpose": "介绍参赛规模和比赛情况",
      "content_guidance": "围绕12个团队参赛展开，可使用数据事实，注意不得编造成果数据。",
      "fact_bindings": [
        {
          "fact_type": "data",
          "fact_value": "12个团队",
          "source_from_extract": true
        }
      ],
      "blocked_items": [
        "不得编造成果数据",
        "不得编造参赛团队详情"
      ],
      "word_count_estimate": 150,
      "needs_manual_input": false
    },
    {
      "section_id": "S4",
      "section_name": "主要内容",
      "purpose": "重点介绍一等奖作品《AI导演》及其成就",
      "content_guidance": "围绕一等奖作品实现全流程AI辅助制作展开，不得编造具体技术细节。",
      "fact_bindings": [
        {
          "fact_type": "product",
          "fact_value": "《AI导演》",
          "source_from_extract": true
        },
        {
          "fact_type": "achievement",
          "fact_value": "一等奖作品《AI导演》实现了全流程AI辅助制作",
          "source_from_extract": true
        }
      ],
      "blocked_items": [
        "不得编造成果具体数据",
        "不得编造作品技术细节",
        "不得编造领导评价"
      ],
      "word_count_estimate": 200,
      "needs_manual_input": false
    },
    {
      "section_id": "S5",
      "section_name": "意义价值",
      "purpose": "升华活动意义，可使用芒果系战略表达",
      "content_guidance": "围绕AI内容创作对行业或公司发展的意义展开，可使用'推动文化和科技融合'等表达，但不得编造活动影响。",
      "fact_bindings": [],
      "blocked_items": [
        "不得编造活动影响",
        "不得编造领导评价"
      ],
      "word_count_estimate": 150,
      "needs_manual_input": false
    },
    {
      "section_id": "S6",
      "section_name": "结尾",
      "purpose": "展望收尾，可用芒果系标准结尾",
      "content_guidance": "以'此次活动展示了…'或'未来将持续…'等句式收尾，避免编造未来规划。",
      "fact_bindings": [],
      "blocked_items": [
        "不得编造领导讲话"
      ],
      "word_count_estimate": 50,
      "needs_manual_input": false
    }
  ],
  "style_directives": {
    "overall_tone": "芒果系新闻宣传风",
    "key_expressions": [
      "X月X日，XX在XX……",
      "以……为主题",
      "融合创新",
      "智领未来"
    ],
    "forbidden_expressions": [
      "不得编造领导出席",
      "不得编造领导评价",
      "不得编造成果数据",
      "不得将内部通知写成新闻传播稿",
      "不得编造活动影响",
      "不得编造成果名称"
    ],
    "style_reference": "doc-type-rules.md 新闻稿章节"
  },
  "title_rules": [
    "新闻稿标题应有传播性",
    "可使用对仗、比喻等修辞"
  ],
  "addressee_resolution": {
    "recommended_addressee": "",
    "source": "not_applicable",
    "confidence": 0,
    "needs_manual_confirmation": false,
    "note": "新闻稿无需主送单位"
  },
  "signer_resolution": {
    "recommended_signer": "",
    "source": "not_applicable",
    "confidence": 0,
    "needs_manual_confirmation": false,
    "note": "新闻稿无需落款"
  },
  "title_suggestions": {
    "recommended_title": "芒果超媒AI内容创作大赛举行 《AI导演》获一等奖",
    "alternative_titles": [
      "芒果超媒举办AI内容创作大赛 12个团队同台竞技"
    ],
    "title_rules": [
      "新闻稿标题应有传播性",
      "可使用对仗、比喻等修辞"
    ]
  },
  "missing_fields": [
    {
      "field": "活动地点",
      "reason": "用户未提供活动举办地点"
    },
    {
      "field": "获奖作品具体细节",
      "reason": "用户只说明一等奖作品实现了全流程AI辅助制作，未提供具体技术或团队成员"
    },
    {
      "field": "参赛团队详情",
      "reason": "用户只提供团队数量，未提供团队名称或来源"
    }
  ],
  "cannot_infer": [
    {
      "field": "领导出席情况",
      "reason": "用户素材未提供领导出席信息，不得自动补充"
    },
    {
      "field": "领导评价",
      "reason": "用户素材未提供领导评价，不得自动写入"
    },
    {
      "field": "活动影响",
      "reason": "用户素材未提供活动影响或传播效果"
    },
    {
      "field": "一等奖作品具体技术细节",
      "reason": "用户未提供，不得自行补充"
    }
  ],
  "risk_flags": [
    {
      "type": "event_without_time_location",
      "detail": "活动缺少地点信息",
      "level": "medium"
    },
    {
      "type": "achievement_without_data",
      "detail": "获奖作品成就未提供具体数据支撑（如效率提升比例等）",
      "level": "medium"
    },
    {
      "type": "incomplete_organization_name",
      "detail": "组织机构名称以简称形式出现（芒果超媒），可能缺少全称",
      "level": "low"
    }
  ],
  "manual_confirmation_fields": [],
  "draft_directives": {
    "total_word_count_estimate": 700,
    "must_use_facts": [
      "4月15日",
      "芒果超媒",
      "AI内容创作大赛",
      "12个团队",
      "《AI导演》",
      "一等奖作品《AI导演》实现了全流程AI辅助制作"
    ],
    "must_avoid": [
      "不得编造领导出席",
      "不得编造领导评价",
      "不得编造成果数据",
      "不得将内部通知写成新闻传播稿",
      "不得编造活动影响",
      "不得编造成果名称",
      "不得编造参赛团队详情",
      "不得补充活动地点"
    ],
    "format_requirements": [
      "导语5W1H",
      "结尾展望升华",
      "使用芒果系新闻宣传风格"
    ]
  }
}