{
  "plan_summary": "用户需求为芒果系新闻稿，素材包含活动时间、主办方、参赛团队、获奖作品等基本信息，但缺少活动地点、团队具体名称和意义价值。结构按新闻稿标准六段式规划，风险较低。",
  "doc_type": "新闻稿",
  "direction": "对外宣传",
  "style_level": 3,
  "risk_level": "low",
  "title_plan": {
    "recommended_title": "芒果超媒举办AI内容创作大赛 《AI导演》获一等奖实现全流程AI辅助制作",
    "title_type": "直述式",
    "title_confidence": 0.85,
    "title_basis": [
      "extract.time = 4月15日",
      "extract.organization = 芒果超媒",
      "extract.event = AI内容创作大赛",
      "extract.product = 《AI导演》",
      "extract.achievement = 一等奖作品《AI导演》实现了全流程AI辅助制作"
    ],
    "title_risks": [],
    "alternative_titles": [
      "以AI之名，智领未来——芒果超媒AI内容创作大赛圆满举行"
    ]
  },
  "addressee_plan": {
    "recommended_addressee": null,
    "source": "not_applicable",
    "confidence": 0,
    "needs_manual_confirmation": false,
    "note": "新闻稿不设主送单位"
  },
  "signer_plan": {
    "recommended_signer": null,
    "source": "not_applicable",
    "confidence": 0,
    "needs_manual_confirmation": false,
    "note": "新闻稿无需落款"
  },
  "sections": [
    {
      "section_id": "S1",
      "section_name": "标题",
      "purpose": "吸引读者，概括核心信息",
      "content_guidance": "使用直述式标题，突出时间、主办方、大赛名称和获奖作品，可适当使用芒果系品牌关键词",
      "fact_bindings": [
        {
          "fact_type": "time",
          "fact_value": "4月15日",
          "source_from_extract": true
        },
        {
          "fact_type": "organization",
          "fact_value": "芒果超媒",
          "source_from_extract": true
        },
        {
          "fact_type": "event",
          "fact_value": "AI内容创作大赛",
          "source_from_extract": true
        },
        {
          "fact_type": "product",
          "fact_value": "《AI导演》",
          "source_from_extract": true
        },
        {
          "fact_type": "achievement",
          "fact_value": "一等奖作品《AI导演》实现了全流程AI辅助制作",
          "source_from_extract": true
        }
      ],
      "blocked_items": [
        "不得编造领导出席信息写入标题",
        "不得夸大获奖影响"
      ],
      "word_count_estimate": 30,
      "needs_manual_input": false
    },
    {
      "section_id": "S2",
      "section_name": "导语",
      "purpose": "5W1H开头：时间、地点、主体、核心事件",
      "content_guidance": "按照“4月15日，芒果超媒在XX举办AI内容创作大赛”句式展开（地点缺失，可概括为“在马栏山”或留空待确认），突出12个团队参与及一等奖作品",
      "fact_bindings": [
        {
          "fact_type": "time",
          "fact_value": "4月15日",
          "source_from_extract": true
        },
        {
          "fact_type": "organization",
          "fact_value": "芒果超媒",
          "source_from_extract": true
        },
        {
          "fact_type": "event",
          "fact_value": "AI内容创作大赛",
          "source_from_extract": true
        },
        {
          "fact_type": "person",
          "fact_value": "12个团队",
          "source_from_extract": true
        },
        {
          "fact_type": "data",
          "fact_value": "12个团队",
          "source_from_extract": true
        },
        {
          "fact_type": "product",
          "fact_value": "《AI导演》",
          "source_from_extract": true
        }
      ],
      "blocked_items": [
        "不得编造活动地点",
        "不得编造领导出席",
        "不得编造参赛人数"
      ],
      "word_count_estimate": 80,
      "needs_manual_input": false
    },
    {
      "section_id": "S3",
      "section_name": "事件主体",
      "purpose": "介绍大赛背景、赛制、参与情况",
      "content_guidance": "围绕12个团队参赛、大赛主题（AI内容创作）展开，可简述大赛目的和亮点，但不得编造具体赛程或评委信息",
      "fact_bindings": [
        {
          "fact_type": "organization",
          "fact_value": "芒果超媒",
          "source_from_extract": true
        },
        {
          "fact_type": "event",
          "fact_value": "AI内容创作大赛",
          "source_from_extract": true
        },
        {
          "fact_type": "person",
          "fact_value": "12个团队",
          "source_from_extract": true
        },
        {
          "fact_type": "data",
          "fact_value": "12个团队",
          "source_from_extract": true
        }
      ],
      "blocked_items": [
        "不得编造领导出席或讲话",
        "不得编造评委名单",
        "不得编造参赛团队具体名称"
      ],
      "word_count_estimate": 200,
      "needs_manual_input": false
    },
    {
      "section_id": "S4",
      "section_name": "主要内容",
      "purpose": "重点报道一等奖作品《AI导演》及其创新价值",
      "content_guidance": "详细描述一等奖作品《AI导演》实现全流程AI辅助制作的意义，但不得编造技术细节或应用场景",
      "fact_bindings": [
        {
          "fact_type": "product",
          "fact_value": "《AI导演》",
          "source_from_extract": true
        },
        {
          "fact_type": "achievement",
          "fact_value": "一等奖作品《AI导演》实现了全流程AI辅助制作",
          "source_from_extract": true
        }
      ],
      "blocked_items": [
        "不得编造作品具体功能",
        "不得夸大技术先进性",
        "不得编造其他获奖作品"
      ],
      "word_count_estimate": 150,
      "needs_manual_input": false
    },
    {
      "section_id": "S5",
      "section_name": "意义价值",
      "purpose": "点明大赛对芒果超媒AI布局和行业发展的意义",
      "content_guidance": "从芒果超媒推动文化和科技融合的角度进行意义升华，可使用“融合创新”“智媒跃升”等战略表达，但不得编造具体数据或外部评价",
      "fact_bindings": [],
      "blocked_items": [
        "不得编造领导评价",
        "不得编造市场反响",
        "不得编造获奖数量"
      ],
      "word_count_estimate": 100,
      "needs_manual_input": false
    },
    {
      "section_id": "S6",
      "section_name": "结尾",
      "purpose": "展望未来，呼应主题",
      "content_guidance": "以芒果系常见收尾句式（如“以AI之名，智领未来”“持续推动内容与技术深度融合”）结束，不编造具体计划",
      "fact_bindings": [],
      "blocked_items": [
        "不得编造后续活动",
        "不得编造具体时间规划"
      ],
      "word_count_estimate": 50,
      "needs_manual_input": false
    }
  ],
  "style_directives": {
    "overall_tone": "芒果系新闻宣传风",
    "key_expressions": [
      "X月X日，XX在XX成功举办……",
      "本次活动以……为主题",
      "以融合创新激活发展动能"
    ],
    "forbidden_expressions": [
      "不得编造领导出席",
      "不得编造领导评价",
      "不得编造成果数据"
    ],
    "style_reference": "doc-type-rules.md 新闻稿章节"
  },
  "title_rules": [
    "新闻稿标题应有传播性",
    "可使用对仗、比喻等修辞",
    "突出核心信息"
  ],
  "addressee_resolution": {
    "recommended_addressee": null,
    "source": "not_applicable",
    "confidence": 0,
    "needs_manual_confirmation": false,
    "note": null
  },
  "signer_resolution": {
    "recommended_signer": null,
    "source": "not_applicable",
    "confidence": 0,
    "needs_manual_confirmation": false,
    "note": null
  },
  "title_suggestions": {
    "recommended_title": "芒果超媒举办AI内容创作大赛 《AI导演》获一等奖实现全流程AI辅助制作",
    "alternative_titles": [
      "以AI之名，智领未来——芒果超媒AI内容创作大赛圆满举行"
    ],
    "title_rules": [
      "新闻稿标题应有传播性"
    ]
  },
  "missing_fields": [
    {
      "field": "活动地点",
      "reason": "用户初稿未提供活动举办地点",
      "impact": "影响新闻稿完整性",
      "suggestion": "后续写作前建议确认活动地点，或以概括性表述"
    },
    {
      "field": "参赛团队具体名称",
      "reason": "用户只写12个团队，未提供具体团队名称",
      "impact": "影响报道具体性",
      "suggestion": "如需要可补充"
    },
    {
      "field": "活动意义价值",
      "reason": "用户初稿未提供活动意义或价值",
      "impact": "影响新闻稿意义价值部分",
      "suggestion": "后续写作可概括或省略"
    }
  ],
  "cannot_infer": [
    {
      "field": "领导出席情况",
      "reason": "用户素材未提供领导出席信息，不得自动补充"
    },
    {
      "field": "领导评价",
      "reason": "用户素材未提供领导评价，不得自动写入"
    },
    {
      "field": "活动影响",
      "reason": "用户素材未提供活动传播效果或社会反响"
    }
  ],
  "risk_flags": [
    {
      "type": "event_without_time_location",
      "detail": "活动提供了时间，但未提供地点",
      "level": "medium"
    },
    {
      "type": "ambiguous_fact",
      "detail": "参赛团队仅写12个团队，未提供具体名称",
      "level": "low"
    }
  ],
  "manual_confirmation_fields": [],
  "draft_directives": {
    "total_word_count_estimate": 610,
    "must_use_facts": [
      "4月15日",
      "芒果超媒",
      "AI内容创作大赛",
      "12个团队",
      "《AI导演》",
      "一等奖作品《AI导演》实现了全流程AI辅助制作"
    ],
    "must_avoid": [
      "不得编造领导出席",
      "不得编造领导评价",
      "不得编造成果数据",
      "不得编造活动地点",
      "不得编造团队具体名称"
    ],
    "format_requirements": [
      "芒果系新闻宣传风",
      "导语5W1H",
      "结尾展望升华"
    ]
  }
}